{
  "schema_version": "1.0.0",
  "fixture_id": "pt-core-20260205",
  "domain": "pt-core",
  "capture_time": "2026-02-05T06:39:14.214866Z",
  "source": {
    "origin": "manual-copy",
    "command": [
      "cp crates/pt-core/tests/fixtures/*.json test/fixtures/pt-core/",
      "add provenance fixture pack and debug trace fixtures"
    ],
    "paths": ["crates/pt-core/tests/fixtures", "test/fixtures/pt-core"]
  },
  "tool_versions": {
    "fixture_capture": "1.0.0",
    "pt": "2.0.0",
    "schema": "fixture-manifest@1"
  },
  "redaction_profile": "safe",
  "artifacts": [
    {
      "path": "inference_cases_expected.json",
      "kind": "config",
      "sha256": "b46b43666af7d0d0635460328ad1eacb2492982c20372e60d1380b8f202b76e8",
      "bytes": 2614,
      "redaction_profile": "safe"
    },
    {
      "path": "inference_cases_input.json",
      "kind": "config",
      "sha256": "d1fe152e255545a5000e844674780788e89e2858b2bc5e1ac384e45ecff0ba19",
      "bytes": 843,
      "redaction_profile": "safe"
    },
    {
      "path": "invalid_priors.json",
      "kind": "priors",
      "sha256": "ae57783a76fba590cb10c64a0e91623440a8d3ea72fa77acabb65c9add43756b",
      "bytes": 522,
      "redaction_profile": "safe"
    },
    {
      "path": "logs/inference_regression.jsonl",
      "kind": "log",
      "sha256": "130e070239d652cb13e9d9c8c171a6202efc94963bfb4d1bee41f667a21aaf2e",
      "bytes": 1200,
      "redaction_profile": "safe"
    },
    {
      "path": "logs/provenance_debug_trace.jsonl",
      "kind": "log",
      "sha256": "e381d561cafb4ac70e8322b31e03d3c03e54c2a92a2ef2b284cf16398d91428d",
      "bytes": 1250,
      "redaction_profile": "safe"
    },
    {
      "path": "malformed.json",
      "kind": "config",
      "sha256": "9519f39e393c5a95b0c103706ccae1f902a7c7efc88509828a60008fed4d6115",
      "bytes": 98,
      "redaction_profile": "safe"
    },
    {
      "path": "policy.json",
      "kind": "policy",
      "sha256": "b193cd6e7ae269b4ce2464fdc8aed0985e9da76eab600561315bafde0732e321",
      "bytes": 1208,
      "redaction_profile": "safe"
    },
    {
      "path": "provenance_privacy_snapshot.json",
      "kind": "snapshot",
      "sha256": "7ff40d03e234c9d89dc9d0959071ee3b0b24118f9b173a343125e0f8fa819a48",
      "bytes": 5679,
      "redaction_profile": "safe"
    },
    {
      "path": "priors.json",
      "kind": "priors",
      "sha256": "9903dbd003c80395c78c007b7ae648c68d37ebfb7be40d5524fe9a66ab62e7ad",
      "bytes": 1645,
      "redaction_profile": "safe"
    },
    {
      "path": "provenance_output_disabled.json",
      "kind": "snapshot",
      "sha256": "b22dd57de08757a0d1b13df873d62b6640126b14e0f4b71683799033c514f095",
      "bytes": 284,
      "redaction_profile": "safe"
    },
    {
      "path": "provenance_output_full.json",
      "kind": "snapshot",
      "sha256": "e6993803557f68dca1f04010307d1b2cb82dc7cc9e90528b4f635e146b8d70cb",
      "bytes": 869,
      "redaction_profile": "safe"
    },
    {
      "path": "provenance_output_redacted_high_blast.json",
      "kind": "snapshot",
      "sha256": "3d7246edade475208ac20f04ddb11d8a64ca46a4100df078ac22756d96185b55",
      "bytes": 765,
      "redaction_profile": "safe"
    }
  ],
  "description": "pt-core policy/priors + inference + provenance fixtures",
  "manifest_sha256": "244520ac40d2284f307a05d6cab3bd0098f7bb45abe4801f1d79f51717ab3f92"
}
